### ISSUE TITLE
Issue with ClamAV version 1.3.0

### ISSUE THREAD

**Issue by Matthias-Heinz** [tekmaven/nClam#74]
Setting:
- We have 2 separate servers running ClamAV; one of which is on an older version of roughly 0.7.0 and the other one has recently received an update to version 1.3.0.
- Our C# .NET Framework 4.8 application is using the latest nClam version 9.0.0 and running fine against the ClamAV server with the old version.

Now we've been testing the nClam library against version 1.3.0 of ClamAV using 

- the EICAR test file/data 
- a harmless string of text, ASCII endcoded

and are having an issue:

Specifically, calling into `ClamClient::SendAndScanFileAsync(byte[] fileData)` (with either payload) just hangs indefinitely during the evaluation of the following line of code: https://github.com/tekmaven/nClam/blob/master/nClam/ClamClient.cs#L96

I've used wireshark to capture the traffic during the scan:
Packages:
```
Direction            Protocol Length Info
To ClamAV Instance   TCP      66     51233 → 3310 [SYN] Seq=0 Win=64240 Len=0 MSS=1460 WS=256 SACK_PERM
From ClamAV Instance TCP      66     3310 → 51233 [SYN, ACK] Seq=0 Ack=1 Win=8192 Len=0 MSS=1460 WS=256 SACK_PERM
To ClamAV Instance   TCP      54     51233 → 3310 [ACK] Seq=1 Ack=1 Win=262656 Len=0
To ClamAV Instance   TCP      64     51233 → 3310 [PSH, ACK] Seq=1 Ack=1 Win=262656 Len=10
From ClamAV Instance TCP      60     3310 → 51233 [ACK] Seq=1 Ack=11 Win=525568 Len=0
To ClamAV Instance   TCP      130    51233 → 3310 [PSH, ACK] Seq=11 Ack=1 Win=262656 Len=76
From ClamAV Instance TCP      60     3310 → 51233 [ACK] Seq=1 Ack=87 Win=525312 Len=0
<<"hangs indefinitely here" / "end of tcp stream">>
```
TCP-stream content (in case of the EICAR test data):
```
00000000  7a 49 4e 53 54 52 45 41  4d 00                     zINSTREA M.
0000000A  00 00 00 44 58 35 4f 21  50 25 40 41 50 5b 34 5c   ...DX5O! P%@AP[4\
0000001A  50 5a 58 35 34 28 50 5e  29 37 43 43 29 37 7d 24   PZX54(P^ )7CC)7}$
0000002A  45 49 43 41 52 2d 53 54  41 4e 44 41 52 44 2d 41   EICAR-ST ANDARD-A
0000003A  4e 54 49 56 49 52 55 53  2d 54 45 53 54 2d 46 49   NTIVIRUS -TEST-FI
0000004A  4c 45 21 24 48 2b 48 2a  00 00 00 00               LE!$H+H* ....
```

Is there any way you could verify the library against a ClamAV server of version 1.3.0 or help us troubleshoot this issue?

If you need any further information, please let me know!

Kind regards!

**Comment by tekmaven** [comment]
Hey, thanks for using the library and reporting the issue.  I tried to reproduce it, but I unfortunately cannot.  

I don't have the best Windows environment anymore, but I was able to get a Windows 10 VM with .NET 4.8 on it.  If I update the ConsoleTest app to use `SendAndScanFileAsync`, compile it for .NET 4.8 and run it on that VM (with ClamAV 1.3.0 running on the same VM), I can get a successful scan.  Also, if I put an EICAR test string in the file, I do get a virus found result.  Example output of the console app:

```
C:\Users\ryan\Desktop\net48>nClam.ConsoleTest.exe
nClam Test Application

        * Testing connectivity: connected.
        * Scanning file: Virus Found!
Virus name:  Eicar-Signature
```

I also did verify .NET 8 on OS X works properly (my current development environment).

**Comment by Matthias-Heinz** [comment]
This is my sample code:
```
using nClam;
using System;
using System.Text;
using System.Threading.Tasks;

namespace ClamAV_TestConsole2
{
    public class Program
    {
        public static void Main(string[] args)
        {
            Test().Wait();
        }

        private static async Task Test()
        {
            var server = "192.168.1.2"; // local IP other than "localhost" or "127.0.0.1"
            int port = 3310;
            byte[] dataToScan = Encoding.ASCII.GetBytes(@"X5O!P%@AP[4\PZX54(P^)7CC)7}$EICAR-STANDARD-ANTIVIRUS-TEST-FILE!$H+H*"); // EICAR test data

            Console.WriteLine("Starting test...");
            var clam = new ClamClient(server, port);

            Console.Write("Querying the ClamAV server... ");
            var scanResult = await clam.SendAndScanFileAsync(dataToScan);
            Console.WriteLine("Done.");

            switch (scanResult.Result)
            {
                case ClamScanResults.Clean:
                    Console.WriteLine("The file is clean!");
                    break;
                case ClamScanResults.VirusDetected:
                    Console.WriteLine("Virus Found!");
                    Console.WriteLine("Virus name: {0}", scanResult.InfectedFiles[0].VirusName);
                    break;
                case ClamScanResults.Error:
                    Console.WriteLine("Woah an error occured! Error: {0}", scanResult.RawResult);
                    break;
                case ClamScanResults.Unknown:
                default:
                    Console.WriteLine("Something unknow did happen!");
                    break;
            }

            Console.WriteLine("End of test!");
            Console.ReadLine();
        }
    }
}
```

I've been running this sample code from 
- my development machine targeting .NET Framework 4.8 
- and on the server itself targeting .NET 6.0 (as a self contained application, because the server does not have .NET installed at all)

but both attempts yield the same result: The application hangs indefinitely during the `await clam.SendAndScanFileAsync(dataToScan);`.

**Differences between our setups**, that I might have identified:
1. As mentioned earlier, we're running the ClamAV instance on a different host and thus cannot refer to the server as "localhost" nor "127.0.0.1". Maybe you could try to use your local network IP instead of the loop-back interface, if you haven't already? I certainly don't hope, this will make any difference, but who knows...
2. I'm using the overload with the following signature: `public Task<ClamScanResult> SendAndScanFileAsync(byte[] fileData)`, which seems to call `await ExecuteClamCommandAsync("INSTREAM", [...])`, whereas your prior post suggests that you're calling `public Task<ClamScanResult> ScanFileOnServerMultithreadedAsync(string filePath)`, which ultimately calls `await ExecuteClamCommandAsync("MULTISCAN " + filePath, [...])`.
**Note** the difference in API commands **INSTREAM** and **MULTISCAN**!
3. Not sure about yours, but our ClamAV instance is running as Administrator.

Would you mind taking a second look at your end?

**Comment by tekmaven** [comment]
Thanks for diving deep here.  I tried your code with the following setups:

- Win10 .NET 4.8 running console app, which connects to a remote clamav running on my macbook via IP.
- OS X .NET 8 running console app, which connects to a remote clamav running on my Windows VM via IP.

Both work properly and display the following output:
```
Starting test...
Querying the ClamAV server... Done.
Virus Found!
Virus name:  Win.Test.EICAR_HDB-1
End of test!
```

I did discover one thing.  If the remote server was incorrect (if you put an invalid IP address, for example I put `192.168.1.158` in, which is not a valid IP on my network), the TCPClient would take a long time trying to connect before it would throw.  On Mac/.NET 8 it took >1 minute to throw, and on Win10/.NET4.8 it took >20 seconds to throw.

Here are some ideas for next steps:
1. Could you let the test app run for a few minutes to see if it throws an exception?
2. We should also confirm your ClamAV server is remotely accessible.  Can you `telnet 192.168.1.2 3310` on the machine running the test?

**Comment by Matthias-Heinz** [comment]
Just ran the console app for over 20 minutes and still no change in behavior.

I don't have telnet enabled on my machine, but I don't think remote accessibility is an issue:
1. Running `netstat -an` on the ClamAV server:
- There's an entry for a `listening` program on the specified ip and port 3310 that matches the `clamd.conf` file.
- While the console is running, there's an additional incoming tcp connection on port 3310 from the PC running the console, that stays connected until I manually quit the (seemingly hanging) console program.
2. Prior to updating this ClamAV server to version 1.3.0, it ran version 0.7.0 (as our other instance still does) and back then everything did work just fine.
3. The Windows Firewall still contains a rule to allow incoming traffic on port 3310.
4. Coming back to my first post, which includes the Wireshark traffic analysis (and I'm not an expert here!): Something at least did respond to the tcp packages sending a sequence of [SYN, ACK], [ACK] and [ACK]. I did assume, this response is generated by ClamAV, but maybe I'm wrong and this is returned by the OSI transport layer and ClamAV never received the request...
5. I'm getting the same issue when running the test console directly on the ClamAV server.

I've also double checked / compared the `clamd.conf` and `freshclam.conf` files between the working instance running version 0.7.0 and the test server running 1.3.0 and except for the `TCPAddr` field, they're identical. Notably, we did reconfigure the clamd.conf to set
- StreamMaxLength 4294967295
- MaxScanSize 4294967295
- MaxFileSize 4294967295

(which is 1 byte less than 4GB) on both instances and which are the only 3 active options except for the TCPAddr and the TCPSocket. (And of course the freshclam.conf declares `DatabaseMirror database.clamav.net`; but this config shouldn't be relevant for this issue, I guess...)

Just a heads-up: I probably won't respond within the next 2 weeks.

**Comment by Matthias-Heinz** [comment]
As mentioned in my previous post in bullet points 1 and 5, my console application used for testing does encounter the same issue when run from a remote PC or when run on the clam AV server itself, so I'd rule out a connection issue (port closed, network connectivity, ...).

Are you aware of any logs written by the clam AV server, that I could pull to troubleshoot the issue?

**Comment by Matthias-Heinz** [comment]
We've decided to reinstall our ClamAV server of version 1.3.0 and now it looks like everything is working just fine. We didn't change anything on purpose, so I can't answer, what exactly made the difference, but so be it.

Sorry for taking up your time.
